{
  "schema_version": "model_run_record_v1",
  "run_id": "run_008",
  "task_set_id": "synthetic_copy_rename_v1",
  "task_id": "SYN_105",
  "model": {
    "model_name": "qwen2.5:7b-instruct-q4_0",
    "provider": "ollama"
  },
  "prompt": {
    "track": "multi_candidate_v1",
    "template_id": "run_task_set_ollama_multi_v1",
    "template_version": "0.1.0"
  },
  "generation": {
    "temperature": 0.7
  },
  "status": "ok",
  "selected_candidate_id": "c2",
  "candidates": [
    {
      "candidate_id": "c1",
      "raw_text": "{\n  \"plan_id\": \"12345\",\n  \"task_id\": \"SYN_105\",\n  \"target_entity\": \"canonical_user_profile\",\n  \"field_mappings\": [\n    {\n      \"target_field\": \"birth_date\",\n      \"operation\": \"parse_date\",\n      \"source_paths\": [\"$.fecha_nacimiento\"]\n    }\n  ],\n  \"joins\": [],\n  \"filters\": [],\n  \"aggregations\": [],\n  \"assumptions\": [\n    \" fecha_nacimiento is a string in date format\"\n  ]\n}",
      "candidate_plan": {
        "plan_id": "12345",
        "task_id": "SYN_105",
        "target_entity": "canonical_user_profile",
        "field_mappings": [
          {
            "target_field": "birth_date",
            "operation": "parse_date",
            "source_paths": [
              "$.fecha_nacimiento"
            ]
          }
        ],
        "joins": [],
        "filters": [],
        "aggregations": [],
        "assumptions": [
          " fecha_nacimiento is a string in date format"
        ]
      },
      "parse_error": null
    },
    {
      "candidate_id": "c2",
      "raw_text": "{\n  \"plan_id\": \"SYN_105_Mapping\",\n  \"task_id\": \"SYN_105\",\n  \"target_entity\": \"canonical_user_profile\",\n  \"field_mappings\": [\n    {\n      \"target_field\": \"birth_date\",\n      \"operation\": \"parse_date\",\n      \"source_paths\": [\"$.fecha_nacimiento\"]\n    }\n  ],\n  \"joins\": [],\n  \"filters\": [],\n  \"aggregations\": [],\n  \"assumptions\": []\n}",
      "candidate_plan": {
        "plan_id": "SYN_105_Mapping",
        "task_id": "SYN_105",
        "target_entity": "canonical_user_profile",
        "field_mappings": [
          {
            "target_field": "birth_date",
            "operation": "parse_date",
            "source_paths": [
              "$.fecha_nacimiento"
            ]
          }
        ],
        "joins": [],
        "filters": [],
        "aggregations": [],
        "assumptions": []
      },
      "parse_error": null
    },
    {
      "candidate_id": "c3",
      "raw_text": "{\n  \"plan_id\": \"SYN_105_mapping_plan\",\n  \"task_id\": \"SYN_105\",\n  \"target_entity\": \"canonical_user_profile\",\n  \"field_mappings\": [\n    {\n      \"target_field\": \"birth_date\",\n      \"operation\": \"parse_date\",\n      \"source_paths\": [\"$.fecha_nacimiento\"]\n    }\n  ],\n  \"joins\": [],\n  \"filters\": [],\n  \"aggregations\": [],\n  \"assumptions\": []\n}",
      "candidate_plan": {
        "plan_id": "SYN_105_mapping_plan",
        "task_id": "SYN_105",
        "target_entity": "canonical_user_profile",
        "field_mappings": [
          {
            "target_field": "birth_date",
            "operation": "parse_date",
            "source_paths": [
              "$.fecha_nacimiento"
            ]
          }
        ],
        "joins": [],
        "filters": [],
        "aggregations": [],
        "assumptions": []
      },
      "parse_error": null
    }
  ],
  "usage": {
    "latency_ms": 27117.173
  },
  "timestamps": {
    "started_at": "2026-03-30T13:31:24.825708+00:00",
    "finished_at": "2026-03-30T13:31:51.942881+00:00"
  },
  "notes": []
}