{
  "schema_version": "model_run_record_v1",
  "run_id": "run_008",
  "task_set_id": "synthetic_copy_rename_v1",
  "task_id": "SYN_104",
  "model": {
    "model_name": "qwen2.5:7b-instruct-q4_0",
    "provider": "ollama"
  },
  "prompt": {
    "track": "multi_candidate_v1",
    "template_id": "run_task_set_ollama_multi_v1",
    "template_version": "0.1.0"
  },
  "generation": {
    "temperature": 0.7
  },
  "status": "ok",
  "selected_candidate_id": "c1",
  "candidates": [
    {
      "candidate_id": "c1",
      "raw_text": "{\n  \"plan_id\": \"1\",\n  \"task_id\": \"SYN_104\",\n  \"target_entity\": \"canonical_user_profile\",\n  \"field_mappings\": [\n    {\n      \"target_field\": \"birth_date\",\n      \"operation\": \"default_value\",\n      \"source_paths\": []\n    }\n  ],\n  \"joins\": [],\n  \"filters\": [],\n  \"aggregations\": [],\n  \"assumptions\": [\n    \"activity_count is assumed to be a string representing a date\"\n  ]\n}",
      "candidate_plan": {
        "plan_id": "1",
        "task_id": "SYN_104",
        "target_entity": "canonical_user_profile",
        "field_mappings": [
          {
            "target_field": "birth_date",
            "operation": "default_value",
            "source_paths": []
          }
        ],
        "joins": [],
        "filters": [],
        "aggregations": [],
        "assumptions": [
          "activity_count is assumed to be a string representing a date"
        ]
      },
      "parse_error": null
    },
    {
      "candidate_id": "c2",
      "raw_text": "{\n  \"plan_id\": \"SYN_104Plan\",\n  \"task_id\": \"SYN_104\",\n  \"target_entity\": \"canonical_user_profile\",\n  \"field_mappings\": [\n    {\n      \"target_field\": \"$.birth_date\",\n      \"operation\": \"default_value\",\n      \"source_paths\": [\"$.activity_count\"]\n    }\n  ],\n  \"joins\": [],\n  \"filters\": [],\n  \"aggregations\": [],\n  \"assumptions\": [\n    \"Assuming 'activity_count' represents a date in string format.\"\n  ]\n}",
      "candidate_plan": {
        "plan_id": "SYN_104Plan",
        "task_id": "SYN_104",
        "target_entity": "canonical_user_profile",
        "field_mappings": [
          {
            "target_field": "$.birth_date",
            "operation": "default_value",
            "source_paths": [
              "$.activity_count"
            ]
          }
        ],
        "joins": [],
        "filters": [],
        "aggregations": [],
        "assumptions": [
          "Assuming 'activity_count' represents a date in string format."
        ]
      },
      "parse_error": null
    },
    {
      "candidate_id": "c3",
      "raw_text": "{\n  \"plan_id\": \"SYN_104_MAPPING_PLAN\",\n  \"task_id\": \"SYN_104\",\n  \"target_entity\": \"canonical_user_profile\",\n  \"field_mappings\": [\n    {\n      \"target_field\": \"birth_date\",\n      \"operation\": \"default_value\",\n      \"source_paths\": [\"$activity_count\"]\n    }\n  ],\n  \"joins\": [],\n  \"filters\": [],\n  \"aggregations\": [],\n  \"assumptions\": [\n    \"Assuming 'activity_count' is a string representation of date and needs to be converted.\"\n  ]\n}",
      "candidate_plan": {
        "plan_id": "SYN_104_MAPPING_PLAN",
        "task_id": "SYN_104",
        "target_entity": "canonical_user_profile",
        "field_mappings": [
          {
            "target_field": "birth_date",
            "operation": "default_value",
            "source_paths": [
              "$activity_count"
            ]
          }
        ],
        "joins": [],
        "filters": [],
        "aggregations": [],
        "assumptions": [
          "Assuming 'activity_count' is a string representation of date and needs to be converted."
        ]
      },
      "parse_error": null
    }
  ],
  "usage": {
    "latency_ms": 28448.754
  },
  "timestamps": {
    "started_at": "2026-03-30T13:30:56.375654+00:00",
    "finished_at": "2026-03-30T13:31:24.824408+00:00"
  },
  "notes": []
}