{
  "schema_version": "model_run_record_v1",
  "run_id": "run_008",
  "task_set_id": "synthetic_copy_rename_v1",
  "task_id": "SYN_109",
  "model": {
    "model_name": "qwen2.5:7b-instruct-q4_0",
    "provider": "ollama"
  },
  "prompt": {
    "track": "multi_candidate_v1",
    "template_id": "run_task_set_ollama_multi_v1",
    "template_version": "0.1.0"
  },
  "generation": {
    "temperature": 0.7
  },
  "status": "ok",
  "selected_candidate_id": "c1",
  "candidates": [
    {
      "candidate_id": "c1",
      "raw_text": "{\n  \"plan_id\": \"P001\",\n  \"task_id\": \"SYN_109\",\n  \"target_entity\": \"canonical_activity_summary\",\n  \"field_mappings\": [\n    {\n      \"target_field\": \"steps\",\n      \"operation\": \"copy\",\n      \"source_paths\": [ \"$.dob\" ]\n    }\n  ],\n  \"joins\": [],\n  \"filters\": [],\n  \"aggregations\": [],\n  \"assumptions\": []\n}",
      "candidate_plan": {
        "plan_id": "P001",
        "task_id": "SYN_109",
        "target_entity": "canonical_activity_summary",
        "field_mappings": [
          {
            "target_field": "steps",
            "operation": "copy",
            "source_paths": [
              "$.dob"
            ]
          }
        ],
        "joins": [],
        "filters": [],
        "aggregations": [],
        "assumptions": []
      },
      "parse_error": null
    },
    {
      "candidate_id": "c2",
      "raw_text": "{\n  \"plan_id\": \"SYN_109_PLAN\",\n  \"task_id\": \"SYN_109\",\n  \"target_entity\": \"canonical_activity_summary\",\n  \"field_mappings\": [\n    {\n      \"target_field\": \"$.steps\",\n      \"operation\": \"copy\",\n      \"source_paths\": [\"$ dob\"]\n    }\n  ],\n  \"joins\": [],\n  \"filters\": [],\n  \"aggregations\": [],\n  \"assumptions\": []\n}",
      "candidate_plan": {
        "plan_id": "SYN_109_PLAN",
        "task_id": "SYN_109",
        "target_entity": "canonical_activity_summary",
        "field_mappings": [
          {
            "target_field": "$.steps",
            "operation": "copy",
            "source_paths": [
              "$ dob"
            ]
          }
        ],
        "joins": [],
        "filters": [],
        "aggregations": [],
        "assumptions": []
      },
      "parse_error": null
    },
    {
      "candidate_id": "c3",
      "raw_text": "{\n  \"plan_id\": \"SYN_109_Mapping_Plan\",\n  \"task_id\": \"SYN_109\",\n  \"target_entity\": \"canonical_activity_summary\",\n  \"field_mappings\": [\n    {\n      \"target_field\": \"steps\",\n      \"operation\": \"copy\",\n      \"source_paths\": [\"$ dob\"]\n    }\n  ],\n  \"joins\": [],\n  \"filters\": [],\n  \"aggregations\": [],\n  \"assumptions\": []\n}",
      "candidate_plan": {
        "plan_id": "SYN_109_Mapping_Plan",
        "task_id": "SYN_109",
        "target_entity": "canonical_activity_summary",
        "field_mappings": [
          {
            "target_field": "steps",
            "operation": "copy",
            "source_paths": [
              "$ dob"
            ]
          }
        ],
        "joins": [],
        "filters": [],
        "aggregations": [],
        "assumptions": []
      },
      "parse_error": null
    }
  ],
  "usage": {
    "latency_ms": 24044.226
  },
  "timestamps": {
    "started_at": "2026-03-30T13:33:09.860669+00:00",
    "finished_at": "2026-03-30T13:33:33.904895+00:00"
  },
  "notes": []
}