{
  "schema_version": "model_run_record_v1",
  "run_id": "run_008",
  "task_set_id": "synthetic_copy_rename_v1",
  "task_id": "SYN_102",
  "model": {
    "model_name": "qwen2.5:7b-instruct-q4_0",
    "provider": "ollama"
  },
  "prompt": {
    "track": "multi_candidate_v1",
    "template_id": "run_task_set_ollama_multi_v1",
    "template_version": "0.1.0"
  },
  "generation": {
    "temperature": 0.7
  },
  "status": "ok",
  "selected_candidate_id": "c1",
  "candidates": [
    {
      "candidate_id": "c1",
      "raw_text": "{\n  \"plan_id\": \"MAPPING_PLAN_102\",\n  \"task_id\": \"SYN_102\",\n  \"target_entity\": \"canonical_user_profile\",\n  \"field_mappings\": [\n    {\n      \"target_field\": \"$.birth_date\",\n      \"operation\": \"copy\",\n      \"source_paths\": [\n        \"$.date_of_birth\"\n      ]\n    }\n  ],\n  \"joins\": [],\n  \"filters\": [],\n  \"aggregations\": [],\n  \"assumptions\": []\n}",
      "candidate_plan": {
        "plan_id": "MAPPING_PLAN_102",
        "task_id": "SYN_102",
        "target_entity": "canonical_user_profile",
        "field_mappings": [
          {
            "target_field": "$.birth_date",
            "operation": "copy",
            "source_paths": [
              "$.date_of_birth"
            ]
          }
        ],
        "joins": [],
        "filters": [],
        "aggregations": [],
        "assumptions": []
      },
      "parse_error": null
    },
    {
      "candidate_id": "c2",
      "raw_text": "{\n  \"plan_id\": \"SYN_102Plan\",\n  \"task_id\": \"SYN_102\",\n  \"target_entity\": \"canonical_user_profile\",\n  \"field_mappings\": [\n    {\n      \"target_field\": \"$.birth_date\",\n      \"operation\": \"copy\",\n      \"source_paths\": [\n        \"$.date_of_birth\"\n      ]\n    }\n  ],\n  \"joins\": [],\n  \"filters\": [],\n  \"aggregations\": [],\n  \"assumptions\": []\n}",
      "candidate_plan": {
        "plan_id": "SYN_102Plan",
        "task_id": "SYN_102",
        "target_entity": "canonical_user_profile",
        "field_mappings": [
          {
            "target_field": "$.birth_date",
            "operation": "copy",
            "source_paths": [
              "$.date_of_birth"
            ]
          }
        ],
        "joins": [],
        "filters": [],
        "aggregations": [],
        "assumptions": []
      },
      "parse_error": null
    },
    {
      "candidate_id": "c3",
      "raw_text": "{\n  \"plan_id\": \"SYN_102_Mapping\",\n  \"task_id\": \"SYN_102\",\n  \"target_entity\": \"canonical_user_profile\",\n  \"field_mappings\": [\n    {\n      \"target_field\": \"birth_date\",\n      \"operation\": \"copy\",\n      \"source_paths\": [\"$.date_of_birth\"]\n    }\n  ],\n  \"joins\": [],\n  \"filters\": [],\n  \"aggregations\": [],\n  \"assumptions\": []\n}",
      "candidate_plan": {
        "plan_id": "SYN_102_Mapping",
        "task_id": "SYN_102",
        "target_entity": "canonical_user_profile",
        "field_mappings": [
          {
            "target_field": "birth_date",
            "operation": "copy",
            "source_paths": [
              "$.date_of_birth"
            ]
          }
        ],
        "joins": [],
        "filters": [],
        "aggregations": [],
        "assumptions": []
      },
      "parse_error": null
    }
  ],
  "usage": {
    "latency_ms": 26914.706
  },
  "timestamps": {
    "started_at": "2026-03-30T13:30:00.734616+00:00",
    "finished_at": "2026-03-30T13:30:27.649323+00:00"
  },
  "notes": []
}