{
  "schema_version": "model_run_record_v1",
  "run_id": "run_008",
  "task_set_id": "synthetic_copy_rename_v1",
  "task_id": "SYN_107",
  "model": {
    "model_name": "qwen2.5:7b-instruct-q4_0",
    "provider": "ollama"
  },
  "prompt": {
    "track": "multi_candidate_v1",
    "template_id": "run_task_set_ollama_multi_v1",
    "template_version": "0.1.0"
  },
  "generation": {
    "temperature": 0.7
  },
  "status": "ok",
  "selected_candidate_id": "c1",
  "candidates": [
    {
      "candidate_id": "c1",
      "raw_text": "{\n  \"plan_id\": \"1\",\n  \"task_id\": \"SYN_107\",\n  \"target_entity\": \"canonical_activity_summary\",\n  \"field_mappings\": [\n    {\n      \"target_field\": \"steps\",\n      \"operation\": \"copy\",\n      \"source_paths\": [ \"$.birth_date\" ]\n    }\n  ],\n  \"joins\": [],\n  \"filters\": [],\n  \"aggregations\": [],\n  \"assumptions\": []\n}",
      "candidate_plan": {
        "plan_id": "1",
        "task_id": "SYN_107",
        "target_entity": "canonical_activity_summary",
        "field_mappings": [
          {
            "target_field": "steps",
            "operation": "copy",
            "source_paths": [
              "$.birth_date"
            ]
          }
        ],
        "joins": [],
        "filters": [],
        "aggregations": [],
        "assumptions": []
      },
      "parse_error": null
    },
    {
      "candidate_id": "c2",
      "raw_text": "{\n  \"plan_id\": \"SYN_107.mapping_plan\",\n  \"task_id\": \"SYN_107\",\n  \"target_entity\": \"canonical_activity_summary\",\n  \"field_mappings\": [\n    {\n      \"target_field\": \"steps\",\n      \"operation\": \"copy\",\n      \"source_paths\": [\"$birth_date\"]\n    }\n  ],\n  \"joins\": [],\n  \"filters\": [],\n  \"aggregations\": [],\n  \"assumptions\": []\n}",
      "candidate_plan": {
        "plan_id": "SYN_107.mapping_plan",
        "task_id": "SYN_107",
        "target_entity": "canonical_activity_summary",
        "field_mappings": [
          {
            "target_field": "steps",
            "operation": "copy",
            "source_paths": [
              "$birth_date"
            ]
          }
        ],
        "joins": [],
        "filters": [],
        "aggregations": [],
        "assumptions": []
      },
      "parse_error": null
    },
    {
      "candidate_id": "c3",
      "raw_text": "{\n  \"plan_id\": \"SYN_107_01\",\n  \"task_id\": \"SYN_107\",\n  \"target_entity\": \"canonical_activity_summary\",\n  \"field_mappings\": [\n    {\n      \"target_field\": \"steps\",\n      \"operation\": \"copy\",\n      \"source_paths\": [\"$.birth_date\"]\n    }\n  ],\n  \"joins\": [],\n  \"filters\": [],\n  \"aggregations\": [],\n  \"assumptions\": []\n}",
      "candidate_plan": {
        "plan_id": "SYN_107_01",
        "task_id": "SYN_107",
        "target_entity": "canonical_activity_summary",
        "field_mappings": [
          {
            "target_field": "steps",
            "operation": "copy",
            "source_paths": [
              "$.birth_date"
            ]
          }
        ],
        "joins": [],
        "filters": [],
        "aggregations": [],
        "assumptions": []
      },
      "parse_error": null
    }
  ],
  "usage": {
    "latency_ms": 25144.091
  },
  "timestamps": {
    "started_at": "2026-03-30T13:32:20.283541+00:00",
    "finished_at": "2026-03-30T13:32:45.427632+00:00"
  },
  "notes": []
}